"Vavachan, Vijoy Kochuveettil, Sherin Joseph, Honey John, and Kachirayil Joseph Saji. ""High-Performance Latex-Compounded Nitrile Rubber for Self-Powered Intelligent Traffic Monitoring with Advanced Signal Conditioning."" ACS Applied Engineering Materials (2024)."
"Soman, Sithara, Kala Ramakrishnan, and Tripti S. Warrier. ""Enhancing Pregnancy Care: Harnessing Label‐Free Immunosensors for Pre‐Eclampsia Detection Using PdNPs/Poly (3, 5‐Diaminobenzoic Acid) Modified Glassy Carbon Electrodes."" ChemistrySelect 9, no. 37 (2024): e202401495."
"Biji, Christy Ann, Jith C. Janardhanan, and Honey John. ""Facile interface engineering of highly stable covalently functionalized graphene oxide-nickel based metal organic framework heterostructures for supercapacitor applications."" Electrochimica Acta 507 (2024): 145158."
"Padmanabhan, Nisha T., Christeena Sabin, H. Unni Krishnan, M. Hrithik, Ushamani Mythili, Madambi K. Jayaraj, and Honey John. ""Analysing the efficacy of TiO2/g-C3N4 nanohybrid electrospun membranes for visible-light photocatalytic water purification."" Chemical Physics Letters 854 (2024): 141547."
"Sunil, Mathew, E. J. Jelmy, Sherin Joseph, and Honey John. ""Exploring the potential of 2D materials in energy harvesting via triboelectric nanogenerators."" In Recent Advances in Materials for Energy Harvesting and Storage, pp. 3-1. Bristol, UK: IOP Publishing, 2024."
"DT Mathew, M Sunil, N Joseph, HK Raj, A Mayeen, N Manoj, P Sagar, and Honey John. “ High-Performance Self-Cleaning Triboelectric Mini Humidity Sensor Enabled by Facet Engineered Titania Nanocrystals Adorned Nylon-6, 6 Electrospun Nanofibers” ACS Applied Engineering Materials 2 (2024): 1845-1856."
"Kumar, Prashant, Gurwinder Singh, Rohan Bahadur, Zhixuan Li, Xiangwei Zhang, C. I. Sathish, Mercy R. Benzigar et al. ""The rise of borophene."" Progress in Materials Science (2024): 101331."
"Mayeen, Anshida, Anjana Santhosh, Noel Joseph, Jiya Jose, Abhirami Manoj, Saju Joseph, Sarita Bhat, and Honey John. ""Flexible, Electrospun Boron Nitride Nanosheets (BNNS)/Hydroxyapatite-PVDF Nanofibers with Superior Piezoelectric/Ferroelectric, Biocompatible Features for Effective Bone Tissue Regeneration."" Journal of Alloys and Compounds (2024): 175111."
"EJ, Jelmy, Rinku Thomas, Ushamani Mythili, and Honey John. ""Selective adsorption of anionic dyes and carbon dioxide using uncarbonized PVA aerogels incorporated with GO/PANI hybrids."" Adsorption (2024): 1-18."
"Radhakrishnan, Sithara, Nisha T. Padmanabhan, Ann Jini Mathews, Youhong Tang, T. Santhanakrishnan, and Honey John. ""Surfactant-Assisted Restructuring of Boron to Borophene: Implications for Enhanced Hydrogen Evolution."" ACS Applied Nano Materials (2024)."
"Joseph, Sicily R., Jith C. Janardhanan, Nisha T. Padmanabhan, Honey John, and Ushamani Mythili. ""Controlled Reaction Dynamics of Cellulose: Revealing the Dual Morphology Nanocrystals."" Materials Today Sustainability (2024): 100860."
"Bijina, V., P. J. Jandas, K. Abhitha, and Honey John. ""Synergistic effect of Tween 20 and TESPT compatibilizers on the performance characteristics of latex imprinted silica-reinforced green tyre tread formulation."" Journal of Industrial and Engineering Chemistry 133 (2024): 367-378. "
"Jelmy, E. J., Mathew Sunil, Chitra Kandappanthodi, P. Rincy, K. J. Saji, Suresh C. Pillai, and Honey John. ""Sustainable energy harvesting and breath sensing with electrospun triboelectric nylon-6."" Journal of Physics: Energy 6, (2024): 025010."
"Janardhanan, Jith C., Nisha T. Padmanabhan, P. J. Janadas, Meera Sathyan, Rinku M. Thomas, Ushamani Mythili, and Honey John. ""Topology structure significance on the applications of morphologically diverse molybdenum disulfide."" Journal of Environmental Chemical Engineering (2024): 112268."
"Sathyan, Meera, P. J. Jandas, and Honey John. ""Superparamagnetic iron oxide assisted transformation of graphene oxide nanolayers to nanoscrolls for supercapacitor electrode materials: Effect of morphology and electrolyte on supercapacitor performance."" Electrochimica Acta 474 (2024): 143576."
"Rafi, Mubeena, Anshida Mayeen, Honey John, and Pramod Gopinath. ""Nanoengineered Fe 3 O 4–GO nanoscrolls: exploring the biofunctional applications through magnetic, optical, structural, and morphological analyses."" New Journal of Chemistry 48, (2024): 9931-9944."
"Aazem, Irthasa, Ryan Walden, E. J. Jelmy, Sithara Radhkrishnan, Honey John, and Suresh C. Pillai. ""Materials for energy-efficient systems and environmental remediation."" In Handbook of Emerging Materials for Sustainable Energy, pp. 741-777. Elsevier, 2024."
"Louis, Jesna, Nisha Thekkekudathingal Padmanabhan, Madambi Kunjukuttan Jayaraj, and Honey John. ""Exploring enhanced interfacial charge separation in ZnO/reduced graphene oxide hybrids on alkaline photoelectrochemical water splitting and photocatalytic pollutant degradation."" Materials Research Bulletin 169 (2024): 112542."
"Das, Athira T., R. Rajesh, and Pramod Gopinath. ""Propagation of Sine hyperbolic Gaussian vortex beam (ShGvB) in vertical anisotropic oceanic turbulence with adaptive optics correction."" Optics Communications (2024): 131260."
"Lakshmi, R., Meema Rasheed, Parvathy O. Chandrasekaran, Jiya Jose, Narayanapillai Manoj, and Pramod Gopinath. ""AIE Luminogen-Rhodamine 6G FRET pair based light harvester and Hg2+ chemosensor for real life applications."" Microchemical Journal 199 (2024): 110209."
"Rafi, Mubeena, Anshida Mayeen, Honey John, and Pramod Gopinath. ""Nanoengineered Fe 3 O 4–GO nanoscrolls: exploring the biofunctional applications through magnetic, optical, structural, and morphological analyses."" New Journal of Chemistry 48,  22 (2024): 9931-9944."
"Thekkayil, Remyamol, Pramod Gopinath, and Honey John. ""The Effect of Graphene Oxide on Optical, Ferroelectric, and Catalytic Properties of Protein-Encapsulated ZnSe Nanocomposite."" (2024)."
"Shilpa, S., and Pramod Gopinath. ""Tuning of stagnation layer properties in colliding laser-produced plasmas."" Optics & Laser Technology 168 (2024): 109944."
"Mayeen, Anshida, Anjana Santhosh, Noel Joseph, Jiya Jose, Abhirami Manoj, Saju Joseph, Sarita Bhat, and Honey John. ""Flexible, Electrospun Boron Nitride Nanosheets (BNNS)/Hydroxyapatite-PVDF Nanofibers with Superior Piezoelectric/Ferroelectric, Biocompatible Features for Effective Bone Tissue Regeneration."" Journal of Alloys and Compounds (2024): 175111."
"Reghu, Gayatri, Praveen Kumar Vemula, Sarita Ganapathy Bhat, and Sreeja Narayanan. ""Harnessing the innate immune system by revolutionizing macrophage-mediated cancer immunotherapy."" Journal of Biosciences 49, (2024): 1-12."
"Joy, Anjumol, M. Megha, Chandini C. Mohan, Jibu Thomas, Sarita G. Bhat, and Senthilkumar Muthuswamy. ""Novel polycaprolactone-based biomimetic grafts enriched with graphene oxide and cerium oxide: Exploring improved osteogenic potential."" Materials Today Chemistry 37 (2024): 102031."
"Narayanan, Sreeja, Adheena Panangattu Baburajan, Mumtaz Muhammad, Andrea Joseph, Praveen Kumar Vemula, and Sarita Ganapathy Bhat. ""Demonstrating the immunostimulatory and cytokine‐augmentation effects of bacterial ghosts on natural killer cells and Caenorhabditis Elegans."" Biotechnology and bioengineering 121, (2024): 959-970."
"Somkuwar, Pranati, R. Bhaskar, Selva Kumar Ramasamy, Leyana K. Shaji, Sarita G. Bhat, Jiya Jose, and Ashok Kumar Somanahalli Kalleshappa. ""A Porphyrin-based NIR fluorescent probe for Bi3+ and potential applications."" Journal of Fluorescence 34, (2024): 775-786."
"Baburajan, Adheena Panangattu, Sarita Ganapathy Bhat, and Sreeja Narayanan. ""Investigating the Immunomodulatory Effects of Antigenic PLGA Nanoparticles and Nutritional Synergy in Caenorhabditis elegans."" BioNanoScience (2024): 1-13."
"Sajeevan, Shilja, Hamy Michel, Jiya Jose, and Sarita G. Bhat. ""Immobilization for enhancement of laccase reusability."" In Bacterial Laccases, (2024) 125-140. "
"Sirajunnisa, P., S. Sreelakshmi, and G. S. Sailaja. ""Lawsonia inermis-organically modified chitosan intercalated bentonite clay: A multifunctional nanotheranostic system for controlled drug delivery, sensing and cellular imaging."" International Journal of Biological Macromolecules 262 (2024): 130209."
"Joseph, Nisha K., Valsamma J. Koshy, Usha K. Aravind, and Charuvila T. Aravindakumar. ""Photo-transformation of ofloxacin in natural aquatic conditions: Impact of Indirect photolysis on the product profile and transformation mechanism."" Chemosphere (2024): 142484."
"Smailov, Bakyt, Usha Aravind, Almagul Kadirbayeva, Nursulu Sarypbekova, Abdugani Azimov, and Nurpeis Issabayev. ""Synthesis of EPAN and applications in the encapsulation of potassium humate."" Green Processing and Synthesis 13, (2024): 20240004."
"Venukumar, Anjali, Abdugani M. Azimov, Gani M. Iztleuov, Vishnu S. Moorchilot, Usha K. Aravind, Marat I. Sataev, Valsamma J. Koshy, and Charuvila T. Aravindakumar. ""Temporal Assessment of Phosphorus Speciation in a Model Ramsar Lake System in Asia."" Hydrology 11,  (2024): 70."
"Joseph, Nisha K., Abdugani M. Azimov, Gani M. Iztleuov, Valsamma J. Koshy, Usha K. Aravind, Marat I. Sataev, and Charuvila T. Aravindakumar. ""Role of the aquatic environment in enhancing and inhibiting phototransformation of pharmaceutically active compounds."" Emerging Contaminants (2024): 100371."
"Francis, Nidhin, Yogesh S. Choudhary, Thomas Abraham, Usha K. Aravind, and Charuvila T. Aravindakumar. ""TMDC-based hybrid photocatalyst for antibiotics degradation: A comprehensive review."" FlatChem 45 (2024): 100653. "
"Sai, OK Sasina, Usha K. Aravind, and Charuvila T. Aravindakumar. ""Pectin-based Encapsulation Systems for Bioactive Components."" (2024)."
"Unnikrishan, Amitha, Nejumal K. Khalid, Manoj P. Rayaroth, Shiny Thomas, Akhil Nazim, Charuvila T. Aravindakumar, and Usha K. Aravind. ""Occurrence and distribution of steroid hormones (estrogen) and other contaminants of emerging concern in a south indian water body."" Chemosphere 351 (2024): 141124."
"Smailov, Bakyt, and Usha Aravind. ""Synthesis of humic acid with the obtaining of potassium humate based on coal waste from the Lenger deposit, Kazakhstan."" Green Processing and Synthesis 13, (2024): 20230150."
"Joseph, Merin, Fredin Paulson, C. Nasrin, S. Aparna, Sebastian Nybin Remello, Suja Haridas, and Usha k Aravind. ""Layer-by-layer assembled graphitic carbon nitride membranes for water treatment."" Chemosphere 353 (2024): 141544."
"Gopalakrishnan, Akhil, Disha V. Janardhanan, Subha Sasi, Charuvila T. Aravindakumar, and Usha K. Aravind. ""Organic micropollutant removal and phosphate recovery by polyelectrolyte multilayer membranes: Impact of buildup interactions."" Chemosphere 350 (2024): 141078."
"Nandan, Sreejith P., Vishnu S. Moorchilot, Amritha Asokan, Sadritdin Turabdzhanov, Ulugbek Mirzarakhmatov, Latofat Rakhimova, C. T. Aravindakumar, and Usha K. Aravind. ""Coir based biofiltration system for enhanced removal of water pollutants."" Next Sustainability 4 (2024): 100045."
"Mathew, Roshan Joseph, Arun R. Chandran, Syam Kishor KS, KV Arun Kumar, K. J. Saji, and U. S. Sajeev. ""Enhanced nonlinear optical properties and optical limiting performance of graphene modified polyaniline composite under pulsed laser regime."" Physica Scripta 99, (2024): 075532."
"Hajara, P., M. R. Shijeesh, K. V. Vijoy, T. Priya Rose, and K. J. Saji. ""Harnessing Energy Through ZnO-Based Triboelectric Nanogenerator: A Comparative Analysis of Polymer Materials, with Emphasis on PVDF Nanofibers."" Journal of Electronic Materials (2024): 1-12."
"Mathew, Roshan Joseph, Arun R. Chandran, K. J. Saji, and U. S. Sajeev. ""Unveiling the enhanced optical limiting of polyaniline–Fullerene composite investigated by z-scan."" Optical Materials 152 (2024): 115428."
"Jelmy, E. J., Mathew Sunil, Chitra Kandappanthodi, P. Rincy, K. J. Saji, Suresh C. Pillai, and Honey John. ""Sustainable energy harvesting and breath sensing with electrospun triboelectric nylon-6."" Journal of Physics: Energy 6, (2024): 025010."
"Chandralekha, N. R., J. Shanthi, L. Cathelene Antonette, and K. K. Anoop. ""Improved Efficiency of Solar Cell using Silane based SnO2 Thin Films with Self-Cleaning and Antifogging Properties."" Silicon 16, (2024): 5121-5134."
"Rasweefali, M. K., S. Sabu, O. K. Sreedevi, MK Raseel Rahman, T. K. Shabeeba, K. K. Anoop, A. Sasidharan, and K. V. Sunooj. ""Influence of chitosan properties and operating parameters on the flocculation efficiency and harvesting of microalgae (Scenedesmus sp.)."" International Journal of Biological Macromolecules (2024): 132894."
"Pauly, Leya, Lekha Mary John, MS Suryan Sivadas, and K. K. Anoop. ""Deep Learning Neural Network (DNN) Coupled Laser Induced Breakdown Spectroscopy for Quantitative Analysis of Copper Alloys."" In IOP Conference Series: Materials Science and Engineering, vol. 1300, no. 1, p. 012006. IOP Publishing, 2024."
"John, Lekha Mary, Akash Kumar Tarai, Manoj Kumar Gundawar, and Anoop KK. ""Self-absorption of emission lines in picosecond-laser-produced gold plasmas."" Physics of Plasmas 31, (2024)."
"Pauly, Leya, and K. K. Anoop. ""Enhancing Quantitative Analysis efficiency with Deep Learning Neural Network Coupled Laser-Induced Breakdown Spectroscopy."""
"Ashok, Anamika, Swathy B. Saseendran, and Asha Arackal Sukumaran. ""Influence of In Situ and Ex Situ Incorporated Cations on the Supercapacitor Performance of Multilayer Ti3C2T x MXene."" ACS Applied Energy Materials (2024)."
"Hajara, P., M. R. Shijeesh, K. V. Vijoy, T. Priya Rose, and K. J. Saji. ""Harnessing Energy Through ZnO-Based Triboelectric Nanogenerator: A Comparative Analysis of Polymer Materials, with Emphasis on PVDF Nanofibers."" Journal of Electronic Materials (2024): 1-12."
"Sam, Shan Abraham, Johannes Seyd, Aladin Ullrich, Florian Jung, Felix Groß, Michal Krupiński, Manfred Albrecht, and Senoy Thomas. ""Size-dependent bistability of magnetic states in soft magnetic cap arrays."" Nanotechnology 35, (2024): 225701."
"Joseph, Merin, Fredin Paulson, C. Nasrin, S. Aparna, Sebastian Nybin Remello, Suja Haridas, and Usha k Aravind. ""Layer-by-layer assembled graphitic carbon nitride membranes for water treatment."" Chemosphere 353 (2024): 141544."
"Joseph, Merin, Suja Haridas, and Sebastian Nybin Remello. ""Heterojunction Engineering of g‐C3N4 with CuO for Enhanced Photocatalytic and Photoelectrochemical Performance."" Energy Technology 12, (2024): 2301340."
"Sebastian, Abin, Siby Mathew, Fazalurahman Kuttassery, Sebastian N. Remello, Keito Sano, Hiroshi Tachibana, and Haruo Inoue. ""Factors Controlling the Photochemical Two-Electron Water Oxidation Initiated By One-Electron in the Molecular Catalyst Sensitized System for Artificial Photosynthesis."" The Journal of Physical Chemistry C 128, (2024): 1087-1099."
"Joseph, Merin, Bhagatram Meena, Rosmy Joy, Sneha Joseph, Rajesh Kumar Sethi, Sebastian Nybin Remello, Suja Haridas, and Challapalli Subrahmanyam. ""Rational design of a gC 3 N 4/Bi 2 S 3/ZnS ternary heterojunction photoanode for improved solar water splitting."" Sustainable Energy & Fuels 8, (2024): 3412-3418."
"Athira, M. P., R. Arun, and Suja Haridas. ""Selective and sensitive non-enzymatic detection of glucose by Cu (ii)–Ni (ii)/SBA-15."" New Journal of Chemistry 48, (2024): 5326-5333."
"Joseph, Merin, Bhagatram Meena, Rosmy Joy, Sneha Joseph, Rajesh Kumar Sethi, Sebastian Nybin Remello, Suja Haridas, and Challapalli Subrahmanyam. ""Rational design of a gC 3 N 4/Bi 2 S 3/ZnS ternary heterojunction photoanode for improved solar water splitting."" Sustainable Energy & Fuels 8, (2024): 3412-3418."
"Joy, Rosmy, and Suja Haridas. ""Polyaniline enfolded titanate perovskite: a promising material for supercapacitor applications."" Polymer Bulletin 81, (2024): 2129-2142."
"Athira, M. P., R. Arun, and Suja Haridas. ""CuO impregnated SBA-15; an efficient catalyst for B–V oxidation of cyclohexanone to caprolactone."" Journal of Porous Materials 31, (2024): 305-316."
"Joseph, Merin, Suja Haridas, and Sebastian Nybin Remello. ""Heterojunction Engineering of g‐C3N4 with CuO for Enhanced Photocatalytic and Photoelectrochemical Performance."" Energy Technology 12, (2024): 2301340."
"Joseph, Merin, Fredin Paulson, C. Nasrin, S. Aparna, Sebastian Nybin Remello, Suja Haridas, and Usha k Aravind. ""Layer-by-layer assembled graphitic carbon nitride membranes for water treatment."" Chemosphere 353 (2024): 141544."
"Joy, Rosmy, Bhagatram Meena, Mohit Kumar, Merin Jospeh, Sneha Joseph, Challapalli Subrahmanyam, and Suja Haridas. ""Exploring the role of ZnS as passivation layer on SrTiO3/Bi2S3 heterojunction photoanode for improved solar water splitting."" Catalysis Today 433 (2024): 114669."
"Sivaselvam, S., Emilia Papasouli, Jibin Kunnumpurathu, C. S. Praveen, Emmanuel N. Koukaras, Michel Rerat, Panaghiotis Karamanis, and Ramapurath S. Jayasree. ""Nanoarchitectonics of fluorescent gold nanoclusters: A platform for image guided photodynamic therapy of hypoxic tumor."" Applied Materials Today 39 (2024): 102273."
"Tamboli, Mohaseen S., Santosh S. Patil, Dong-Kyu Lee, C. S. Praveen, Asiya M. Tamboli, Uk Sim, Kiyoung Lee, Geun Ho Gu, and Chinho Park. ""Dynamic role of dopant and graphene on BiVO4 photoanode for enhanced photoelectrochemical hydrogen production."" Energy 298 (2024): 131329. "
"Yue, Shengnan, C. S. Praveen, Alexander Klyushin, Alexey Fedorov, Masahiro Hashimoto, Qian Li, Travis Jones et al. ""Redox dynamics and surface structures of an active palladium catalyst during methane oxidation."" Nature Communications 15, (2024): 4678."
"Peter, Anmiya, Jiya Jose, Sarita G. Bhat, and K. Abhitha. ""A modified fluorescent probe protocol for evaluating the reactive oxygen species generation by metal and metal oxide nanoparticles in Gram-positive and Gram-negative organisms."" Results in Engineering 24 (2024): 102925."
"Bijina, V., P. J. Jandas, K. Abhitha, and Honey John. ""Synergistic effect of Tween 20 and TESPT compatibilizers on the performance characteristics of latex imprinted silica-reinforced green tyre tread formulation."" Journal of Industrial and Engineering Chemistry 133 (2024): 367-378."
"Narayanan, Sreeja, Adheena Panangattu Baburajan, Mumtaz Muhammad, Andrea Joseph, Praveen Kumar Vemula, and Sarita Ganapathy Bhat. ""Demonstrating the immunostimulatory and cytokine‐augmentation effects of bacterial ghosts on natural killer cells and Caenorhabditis Elegans."" Biotechnology and bioengineering 121, (2024): 959-970."
"Baburajan, Adheena Panangattu, Sarita Ganapathy Bhat, and Sreeja Narayanan. ""Investigating the Immunomodulatory Effects of Antigenic PLGA Nanoparticles and Nutritional Synergy in Caenorhabditis elegans."" BioNanoScience (2024): 1-13."
"Reghu, Gayatri, Praveen Kumar Vemula, Sarita Ganapathy Bhat, and Sreeja Narayanan. ""Harnessing the innate immune system by revolutionizing macrophage-mediated cancer immunotherapy."" Journal of Biosciences 49, (2024): 1-12."
