"Janardhanan, Jith C., Nisha T. Padmanabhan, P. J. Jandas, Nabendu V. Nayar, Narayanapillai Manoj, Suresh C. Pillai, and Honey John. Directed morphology engineering of 2D MoS2 nanosheets to 1D nanoscrolls with enhanced hydrogen evolution and specific capacitance. Journal of Colloid and Interface Science 652 (2023): 240-249."
"Sunil, Mathew, E. J. Jelmy, K. V. Vijoy, K. J. Saji, and Honey John. ""Triboelectric smart shoes for real time position detection."" Sensors and Actuators A: Physical 363 (2023): 114730."
"Sathyan, Meera, P. J. Jandas, M. Venkatesan, Plamen Stamenov, Suresh C. Pillai, and Honey John. ""Iron oxide induced preparation of nanoscrolls of reduced graphene oxide for electrochemical charge storage applications."" Journal of Power Sources 580 (2023): 233384."
"Lazar, K. Anlin, K. V. Vijoy, Shibi Thomas, K. Pradeesh, Honey John, and K. J. Saji. ""A comparative study on impregnation of silver and aluminium nanoparticles into PDMS matrix: Dielectric property tailoring for improving the output performance of triboelectric nanogenerators."" In AIP Conference Proceedings, vol. 2783, no. 1. AIP Publishing, 2023."
"Joseph, Sherin, and Honey John. ""Electrospun Nylon-11 nanofibers for triboelectric energy harvesting."" In AIP Conference Proceedings, vol. 2783, no. 1. AIP Publishing, 2023."
"Mathew, Dhanu Treasa, N. Manoj, K. J. Saji, and Honey John. ""Triboelectric nanogenerator based on industrial oriented lightweight Nylon-6, 6 film."" In AIP Conference Proceedings, vol. 2783, no. 1. AIP Publishing, 2023."
"Vijoy, K. V., K. Anlin Lazar, Honey John, and K. J. Saji. ""Enhancing the triboelectric performance of flexible PDMS/boron nitride composite nanogenerators."" In AIP Conference Proceedings, vol. 2783, no. 1. AIP Publishing, 2023. "
"Sunil, Mathew, K. J. Saji, and Honey John. ""Energy augmentation of triboelectric nanogenerators using PDMS/POA composite."" In AIP Conference Proceedings, vol. 2783, no. 1. AIP Publishing, 2023."
"Sunil, Mathew, K. J. Saji, and Honey John. ""Energy augmentation of triboelectric nanogenerators using PDMS/POA composite."" In AIP Conference Proceedings, vol. 2783, no. 1. AIP Publishing, 2023."
"Vijoy, K. V., Honey John, and K. J. Saji. ""Synergetic effect of interfacial polarization in room temperature cured PDMS-Graphite composite for triboelectric smart mat applications."" Sustainable Energy Technologies and Assessments 58 (2023): 103349."
"Bijina, V., P. J. Jandas, Sherin Joseph, J. Gopu, K. Abhitha, and Honey John. ""Recent trends in industrial and academic developments of green tyre technology."" Polymer Bulletin 80, no. 8 (2023): 8215-8244."
"Shinu, Kunjittikudy Pappukunju, Honey John, and Jayalatha Gopalakrishnan. ""Chitin/deacetylated chitin nanocomposite film for effective adsorption of organic pollutant from aqueous solution."" International Journal of Biological Macromolecules 242 (2023): 125038."
"Elavathingal Johny, Jelmy, Divya Jose, Vijoy Kochuveetil Vavachan, Saji Kachirayil Joseph, and Honey John. ""Enhanced Mechanical Energy Harvesting in Triboelectric Nanogenerator by the Reinforcement of Polypyrrole‐Decorated rGO Sheets in PDMS."" Advanced Engineering Materials 25, no. 13 (2023): 2201789. "
"Lazar, K. Anlin, K. V. Vijoy, Tony Joseph, Honey John, and K. J. Saji. ""Vertically integrated triboelectric nanogenerators using PDMS/LSCO composite."" Materials Science and Engineering: B 292 (2023): 116388."
"Louis, Jesna, Nisha Thekkekudathingal Padmanabhan, Madambi Kunjukuttan Jayaraj, and Honey John. ""Microwave-induced growth of {101̅0} faceted zinc oxide/graphene 2D/2D nanostructures for visible-light photocatalysis and hydrogen evolution reaction."" Journal of Alloys and Compounds 942 (2023): 169071."
"Janardhanan, Jith C., Nisha T. Padmanabhan, Suresh C. Pillai, and Honey John. ""Interface Engineering of 2D NiMOF–MoS2 Hybrids for Electrocatalytic Hydrogen Evolution."" ACS Sustainable Chemistry & Engineering 11, no. 18 (2023): 6890-6902."
"Joseph, Sherin, Nisha T. Padmanabhan, Jiya Jose, and Honey John. ""Antibacterial self-cleaning nylon-11/TiO2nanofiber membranes as triboelectric nanogenerators."" Results in Engineering 17 (2023): 100869."
"Bijina, Vijayan, Ponnath Janardhanan Jandas, Jesvin Jose, Nellorammal Muhammed Ajnas, Kozhikodan Parambil Abhitha, and Honey John. ""Tuning the low rolling resistance, wet grip, and heat build‐up properties of tyre tread formulations using carbon black/thermally exfoliated graphite hybrid fillers."" Journal of Applied Polymer Science 140, no. 8 (2023): e53508."
"Peter, Anmiya, Sherin Joseph, Honey John, and K. Abhitha. ""Edible and food-safe antiviral and antimicrobial smart coatings."" In Antiviral and Antimicrobial Smart Coatings, pp. 453-480. Elsevier, 2023."
"Shilpa, S., and Pramod Gopinath. ""Transition from Regular to Mach Reflection of Shock Waves in Laterally Colliding Laser-Produced Plasmas."" Physics of Wave Phenomena 31, no. 6 (2023): 434-441."
"Lakshmi, B., and Pramod Gopinath. ""Faraday rotation enhancement due to proximity effect of surface plasmon resonance in magnetoplasmonic colloidal mixtures."" Journal of Molecular Liquids 390 (2023): 123103."
"Shilpa, S., and Pramod Gopinath. ""Heterogeneous angularly colliding (Al–Cu) laser-produced plasmas and film deposition."" Applied Physics B 129, no. 10 (2023): 157. "
"Shilpa, S., and Pramod Gopinath. ""Optical emission features of laterally colliding laser-produced plasmas at different ambient pressures."" Spectrochimica Acta Part B: Atomic Spectroscopy 207 (2023): 106757."
"Lakshmi, B., and Pramod Gopinath. ""A simple two-step chemical synthesis of Ni-Au bimetallic nanoparticles for magnetic and optical applications."" In AIP Conference Proceedings, vol. 2783, no. 1. AIP Publishing, 2023."
"Lakshmi, R., and Pramod Gopinath. ""Thermo-optical properties of AIE dye upon restriction of lntramolecular motion."" In AIP Conference Proceedings, vol. 2783, no. 1. AIP Publishing, 2023."
"Srinivasan, Lakshmi, N. Manoj, and Pramod Gopinath. ""Plasmonic nature of graphene quantum dots-an alternative to noble metal plasmonics."" In AIP Conference Proceedings, vol. 2783, no. 1. AIP Publishing, 2023."
"Rafi, Mubeena, Honey John, and Pramod Gopinath. ""Magnetic and optical properties of magnetite/graphene oxide nanohybrid."" In AIP Conference Proceedings, vol. 2783, no. 1. AIP Publishing, 2023."
"Shilpa, S., and Pramod Gopinath. ""Multispecies stagnation layer study in colliding laser produced plasmas."" In Women in Optics and Photonics in India 2022, vol. 12638, pp. 48-50. SPIE, 2023."
"Lakshmi, B., and Pramod Gopinath. ""Ni–Au magnetoplasmonic nanoparticles with a unique intertwined crystal structure showing excellent reduction and tunability of the superparamagnetic blocking temperature."" Nano-Structures & Nano-Objects 34 (2023): 100950."
"Shilpa, S., and Pramod Gopinath. ""Dynamics of angularly colliding laser-produced plasmas in air and argon ambient."" Vacuum 208 (2023): 111729."
"Aiswarya, P., Sarita G. Bhat, and Sreeja Narayanan. ""Organic Nanoparticles in Postharvest Management and the Mechanisms Involved."" Postharvest Nanotechnology for Fresh Horticultural Produce (2023): 49-75."
"Babukutty, Blessy, Chandini C. Mohan, Deepalekshmi Ponnamma, Swapna S. Nair, Jiya Jose, Sarita G. Bhat, and Sabu Thomas. ""In vitro evaluation of anticancer properties of Mn-substituted magnetite ferrofluids with human osteosarcoma and cervical cancer cells."" Journal of Magnetism and Magnetic Materials 588 (2023): 171405."
"Peter, Anmiya, Sreelakshmi Sadanandan, E. S. Bindiya, Nivedya Mohan, Sarita G. Bhat, and K. Abhitha. ""Biofilm inhibition on natural rubber by hydrophilic modification using carboxymethyl chitosan stabilised high energy faceted silver nanoparticles."" Carbohydrate Polymer Technologies and Applications 6 (2023): 100357."
"Aswathy, Ajayakumar, Pookalavan Karicherry Vineetha, Vishal Kandathil, Jiya Jose, Sarita G. Bhat, and Narayanapillai Manoj. ""A simple live cell imaging “turn–on” fluorescence probe for the selective and sensitive detection of aqueous Hg2+ ions."" Journal of Fluorescence 34, no. 4 (2024): 1671-1682."
"Nath, Soorya G., Jiya Jose, K. C. Bins, Sarita G. Bhat, and E. I. Anila. ""Monoclinic yttrium oxide quantum dots surface modified by biotin for bioimaging applications."" Surfaces and Interfaces 40 (2023): 103112."
"D’Rose, Venetia, and Sarita G. Bhat. ""Immunomodulation of gastrointestinal tract by probiotics: an insight into the role of Lactobacillus sp. and Bacillus sp. on immunity."" Journal of BioScience and Biotechnology 12, no. 1 (2023): 59-74."
"Babukutty, Blessy, Deepalekshmi Ponnamma, Swapna S. Nair, Jiya Jose, Saritha G. Bhat, and Sabu Thomas. ""Structural, magnetic and antibacterial properties of manganese-substituted magnetite ferrofluids."" International Journal of Minerals, Metallurgy and Materials 30, no. 7 (2023): 1417-1426."
"D'Rose, Venetia, and Sarita Ganapathy Bhat. ""Whole genome sequence analysis enabled affirmation of the probiotic potential of marine sporulater Bacillus amyloliquefaciens BTSS3 isolated from Centroscyllium fabricii."" Gene 864 (2023): 147305."
"Sritha, K. S., and Sarita G. Bhat. ""Phages and Their Derived Proteins As Promising Alternatives to Mitigate MDR Salmonellae."" In Handbook on Antimicrobial Resistance: Current Status, Trends in Detection and Mitigation Measures, pp. 1-20. Singapore: Springer Nature Singapore, 2023."
"Babukutty, Blessy, Deepalekshmi Ponnamma, Swapna S. Nair, Jiya Jose, Saritha G. Bhat, and Sabu Thomas. ""Structural influence of chromium substituted magnetite ferrofluids on the optical and antibacterial characteristics."" Materials Today Communications 34 (2023): 105439."
"Peter, Anmiya, Menon Divya Ramesh, E. S. Bindiya, Sarita G. Bhat, and K. Abhitha. ""CuO/Ag hybrid nanomaterial coated hydrophilic natural rubber film with minimal bacterial adhesion and contact killing efficiency."" Results in Engineering 17 (2023): 100998."
"Jose, J., V. P. Athira, H. Michel, A. R. Hafeela, S. G. Bhat, S. Thomas, and LP Maria Chapter. ""1—Hydrogels: An overview of the history, classification, principles, applications, and kinetics."" Sustainable Hydrogels: Synthesis, Properties, and Applications (2023)."
"Bindiya, E. S., P. M. Sreekanth, and Sarita G. Bhat. ""Conservation and management of mangrove ecosystem in diverse perspectives."" In Conservation and Sustainable Utilization of Bioresources, pp. 323-352. Singapore: Springer Nature Singapore, 2023. "
"Jose, Jiya, V. P. Athira, Hamy Michel, A. R. Hafeela, Sarita G. Bhat, Sabu Thomas, and L. Pereira Maria. ""Hydrogels: An overview of the history, classification, principles, applications, and kinetics."" Sustainable Hydrogels (2023): 1-22."
"Shaji, Leyana K., Jiya Jose, R. Bhaskar, R. Selva Kumar, V. Vetriarasu, Sarita G. Bhat, and SK Ashok Kumar. ""Smartphone assisted fluorescent-colorimetric probe for bismuth (III) ion and potential applications."" Inorganic Chemistry Communications 147 (2023): 110252."
"Shaji, Leyana K., R. Selva Kumar, Jiya Jose, R. Bhaskar, V. Vetriarasu, Sarita G. Bhat, and SK Ashok Kumar. ""Selective chromogenic and fluorogenic signalling of Hg2+ ions using a benzothiazole-quinolinyl acrylate conjugate and its applications in the environmental water samples and living cells."" Journal of Photochemistry and Photobiology A: Chemistry 434 (2023): 114220."
"Sumitha, N. S., Nidhi G. Krishna, and G. S. Sailaja. ""Chitosan-TEMPO-Oxidized Nanocellulose Magnetic Responsive Patches with Hyperthermia Potential for Smart Melanoma Therapy."" ACS Applied Polymer Materials 5, no. 11 (2023): 9170-9179."
"Sirajunnisa, P., S. Sreelakshmi, S. Prathapan, and G. S. Sailaja. ""Room temperature synthesized metal organic frameworks of Lawsonia inermis: Potential candidates for sensing and cellular imaging."" Journal of Luminescence 261 (2023): 119899."
"Arakkal, Aswin, Paramban Sirajunnisa, and Gopalakrishnanchettiar Sivakamiammal Sailaja. ""Natural rubber latex films with effective growth inhibition against S. aureus via surface conjugated gentamicin."" Journal of Bioactive and Compatible Polymers 38, no. 3 (2023): 220-233."
"Nair, Praseetha R., S. Sreeja, and G. S. Sailaja. ""Aqueous Cissus quadrangularis Stem Extract Integrated Biodegradable Tissue Engineering Scaffold Augments Early Biomimetic and Biomineralization In Vitro."" Trends in Biomaterials & Artificial Organs 37, no. 1 (2023)."
"George, Liz Hannah, Sreedharan Prathapan, Narayanapillai Manoj, Prasanth Rathinam, Salbi Aadithya, and G. S. Sailaja. ""A long-lived photoluminescent silver nanocluster-infused silver terephthalate metal organic framework with antibacterial and biofilm inhibition activity: a high functional resource."" Journal of Materials Chemistry C 11, no. 23 (2023): 7772-7781."
"Moorchilot, Vishnu S., Usha K. Aravind, and Charuvila T. Aravindakumar. ""Occurrence of azo-dyes, plasticizers, and PAH-bound microplastics: an emerging source and sink for hazardous compounds in indoor environments?."" Air Quality, Atmosphere & Health 17, no. 2 (2024): 425-438."
"Moorchilot, Vishnu S., P. Arun, Usha K. Aravind, and Charuvila T. Aravindakumar. ""Human exposure to methyl and butyl parabens and their transformation products in settled dust collected from urban, semi-urban, rural, and tribal settlements in a tropical environment."" Environmental Research 242 (2024): 117805."
"Nejumal, K. K., M. I. Satayev, Manoj P. Rayaroth, P. Arun, D. Dineep, Usha K. Aravind, A. M. Azimov, and C. T. Aravindakumar. ""Degradation studies of bisphenol S by ultrasound activated persulfate in aqueous medium."" Ultrasonics Sonochemistry 101 (2023): 106700."
"Ahmad, Meraj, Sunil Duhan, Raj Kumar Satankar, Usha K. Aravind, and Anand Plappally. ""Long-term reliability assessment of ceramic water filters: strength and electro-kinetic parameter studies."" Desalination and Water Treatment 309 (2023): 200-209."
"John, Reshmi, Charuvila T. Aravindakumar, and Usha K. Aravind. ""Delineating the cascade of molecular events in protein aggregation triggered by Glyphosate, aminomethylphosphonic acid, and Roundup in serum albumins."" Journal of Hazardous Materials 459 (2023): 132158."
"Rayaroth, Manoj P., Usha K. Aravind, Grzegorz Boczkaj, and Charuvila T. Aravindakumar. ""Singlet oxygen in the removal of organic pollutants: An updated review on the degradation pathways based on mass spectrometry and DFT calculations."" Chemosphere (2023): 140203."
"Das, Jyotirmoy, Shouvik Sengupta, Sandipan Bhattacharjee, and Bhaskar Saha. ""An Interactive Design Concept for Sustainability of Terracotta Production"
"Rayaroth, Manoj P., Grzegorz Boczkaj, Olivier Aubry, Usha K. Aravind, and Charuvila T. Aravindakumar. ""Advanced oxidation processes for degradation of water pollutants—ambivalent impact of carbonate species: a review."" Water 15, no. 8 (2023): 1615."
"Reyaroth, Manoj, Usha Aravind, Grzegorz Boczkaj, and Charuvila T. Aravindakumar. ""Nonphotochemical generation of Singlet oxygen in pollutant remediation: A mini-review on the degradation pathway based on mass spectrometry and DFT calculations."" (2023)."
"Gopalakrishnan, Akhil, Jissy Mathew, Jain Maria Thomas, Greeshma Thankachan, Charuvila T. Aravindakumar, and Usha K. Aravind. ""Spectro-kinetic investigations on the release mechanism of lysozyme from layer-by-layer reservoirs."" Colloids and Surfaces B: Biointerfaces 222 (2023): 113135."
"Smailov, B. M., Usha K. Aravind, B. S. Zakirov, A. M. Azimov, A. S. Tleuov, O. K. Beisenbayev, Zh T. Aimenov, and N. N. Issabayev. ""Technology for obtaining chelated organomineral microfertilizers based on humate-containing components."" Rasayan J. Chem 16 (2023): 428-433."
"Wilson, Merin K., Dhanya P. Jacob, Aldrin Antony, M. K. Jayaraj, and S. Jayalekshmi. ""Mn3O4/carbon as a prospective anode for Li-ion cells."" Materials Today: Proceedings (2023)."
"Sharon, Antony, P. S. Subin, M. K. Jayaraj, and Aldrin Antony. ""Fabrication and characterisation of memristor device using sputtered hafnium oxide."" Journal of Materials Science: Materials in Electronics 34, no. 15 (2023): 1192."
"Kumar, Anil, Aldrin Antony, and Pradeep R. Nair. ""Achieving low contact resistivity in PEDOT: PSS/n-Si solar cells."" Physica Scripta 98, no. "
"Sunil, Mathew, E. J. Jelmy, K. V. Vijoy, K. J. Saji, and Honey John. ""Triboelectric smart shoes for real time position detection."" Sensors and Actuators A: Physical 363 (2023): 114730."
"Lazar, K. Anlin, K. V. Vijoy, Shibi Thomas, K. Pradeesh, Honey John, and K. J. Saji. ""A comparative study on impregnation of silver and aluminium nanoparticles into PDMS matrix: Dielectric property tailoring for improving the output performance of triboelectric nanogenerators."" In AIP Conference Proceedings, vol. 2783, no. 1. AIP Publishing, 2023."
"Mathew, Dhanu Treasa, N. Manoj, K. J. Saji, and Honey John. ""Triboelectric nanogenerator based on industrial oriented lightweight Nylon-6, 6 film."" In AIP Conference Proceedings, vol. 2783, no. 1. AIP Publishing, 2023."
"Rigi, V. J., K. Anlin Lazar, P. Hajara, P. Praveen, K. V. Vijoy, and K. J. Saji. ""Large scale deposition of two-dimensional tungsten disulfide films using radio frequency magnetron sputtering."" In AIP Conference Proceedings, vol. 2783, no. 1. AIP Publishing, 2023."
"Vijoy, K. V., K. Anlin Lazar, Honey John, and K. J. Saji. ""Enhancing the triboelectric performance of flexible PDMS/boron nitride composite nanogenerators."" In AIP Conference Proceedings, vol. 2783, no. 1. AIP Publishing, 2023."
"Shaji, Manu, K. J. Saji, and M. K. Jayaraj. ""Room temperature H2S gas sensor based on zinc tin oxide thin film transistor."" In AIP Conference Proceedings, vol. 2783, no. 1. AIP Publishing, 2023."
"Sunil, Mathew, K. J. Saji, and Honey John. ""Energy augmentation of triboelectric nanogenerators using PDMS/POA composite."" In AIP Conference Proceedings, vol. 2783, no. 1. AIP Publishing, 2023."
"Vijoy, K. V., Honey John, and K. J. Saji. ""Synergetic effect of interfacial polarization in room temperature cured PDMS-Graphite composite for triboelectric smart mat applications."" Sustainable Energy Technologies and Assessments 58 (2023): 103349."
"Puthiyottil, Hajara, Priya Rose Thankamani, and Kachirayil Joseph Saji. ""Exploring the effects of substrate and substrate temperature on the properties of radio frequency magnetron sputtered ZnO thin films."" Materials Today Communications 36 (2023): 106455."
"Praveen, P., K. V. Vijoy, and K. J. Saji. ""Electrochemical metallization in PDMS-graphite composite-based neuromorphic memristor."" Materials Today: Proceedings (2023)."
"Lazar, K. Anlin, K. V. Vijoy, Tony Joseph, Honey John, and K. J. Saji. ""Vertically integrated triboelectric nanogenerators using PDMS/LSCO composite."" Materials Science and Engineering: B 292 (2023): 116388."
"Elavathingal Johny, Jelmy, Divya Jose, Vijoy Kochuveetil Vavachan, Saji Kachirayil Joseph, and Honey John. ""Enhanced Mechanical Energy Harvesting in Triboelectric Nanogenerator by the Reinforcement of Polypyrrole‐Decorated rGO Sheets in PDMS."" Advanced Engineering Materials 25, no. 13 (2023): 2201789."
"Jos, Ben, K. J. Saji, and E. I. Anila. ""Effect of Substrate Temperature on Properties of Copper Oxide Thin Films Coated by Spray Pyrolysis."" Journal of Mines, Metals & Fuels 71, no. 1 (2023)."
"KA, Ann Mary, Tessy Paul, Anupama Kuttappan, P. O. Jibin, and K. K. Anoop. ""Dual emitting carbon nanoparticles for tunable white light emission."" Carbon Trends 13 (2023): 100296."
"John, Lekha Mary, and K. K. Anoop. ""Impact of intensity error on temperature estimation in laser-induced breakdown spectroscopy: a numerical study."" Laser Physics 34, no. 1 (2023): 015701."
"Rajendran, Rajeev, E. R. Krishnadev, and K. K. Anoop. ""Direct femtosecond laser processing for generating high spatial frequency LIPSS (HSFL) on borosilicate glasses with large-area coverage."" In Photonics, vol. 10, no. 7, p. 793. MDPI, 2023."
"Prithiviraj, Mohandas, Abhilash Sasidharan, Bindu Murali Krishna, Sarsan Sabu, Kappat Valiyapeediyekkal Sunooj, Kiliyanamkandy Anoop, and Johnsy George. ""Characterization and qualitative evaluation of cassava starch-chitosan edible food wrap enriched with culinary leaf powders for eco-friendly food packaging applications."" Food Science and Technology International 30, no. 8 (2024): 751-763."
"Rajendran, Rajeev, E. R. Krishnadev, and K. K. Anoop. ""Direct femtosecond laser processing for generating high spatial frequency LIPSS (HSFL) on borosilicate glasses with large-area coverage."" In Photonics, vol. 10, no. 7, p. 793. MDPI, 2023."
"John, Lekha Mary, and K. K. Anoop. ""A numerical procedure for understanding the self-absorption effects in laser induced breakdown spectroscopy."" RSC advances 13, no. 42 (2023): 29613-29624."
"Saseendran, Swathy B., Anamika Ashok, and A. S. Asha. ""Flexible and binder-free supercapacitor electrode with high mass loading using transition metal doped MoS2 nanostructures."" Journal of Alloys and Compounds 968 (2023): 172131."
"Ashok, Anamika, Thottathil Kuttykrishnan Krishnapriya, Swathy Beena Saseendran, Merin Kuzhikkottaparambil Wilson, Murali Niranjana, and Arackal Sukumaran Asha. ""Carbon Dot/Ti3C2Tx MXene Hybrid on Carbon Cloth as a Flexible and Binder‐Free Supercapacitor Electrode with Commercial Scale Mass Loading."" Energy Technology 11, no. 12 (2023): 2300558. "
"Krishnapriya, T. K., Ayswaria Deepti, PS Baby Chakrapani, A. S. Asha, and M. K. Jayaraj. ""Biocompatible, Europium-Doped Fluorapatite Nanoparticles as a Wide-Range pH Sensor."" Journal of Fluorescence (2023): 1-13."
"Saseendran, Swathy B., Anamika Ashok, M. K. Jayaraj, R. Reshmi, and A. S. Asha. ""Single step growth of vertical MoS2 thin films by chemical vapor deposition for hydrogen evolution reaction."" Journal of Materials Science: Materials in Electronics 34, no. 15 (2023): 1233."
"Krishnapriya, T. K., S. Prasanth, Ayswaria Deepti, PS Baby Chakrapani, A. S. Asha, and M. K. Jayaraj. ""Ultrafast detection of folic acid in nanomolar levels and cancer cell imaging using hydrothermally synthesized carbon dots."" Microchemical Journal 188 (2023): 108470."
"Saif, Safna, S. S. Sanker, Karthika Sankar, K. N. Madhusoodanan, and T. Priya Rose. ""Synthesis and optical characterization of 3D self assembled free standing photonic crystal."" In AIP Conference Proceedings, vol. 2783, no. 1. AIP Publishing, 2023."
"Saif, Safna, Sree Sanker SS, Karthika Sankar, Milan K. Moncy, P. V. Harikrishnan, K. N. Madhusoodanan, and T. Priya Rose. ""Emission studies on carbon dot embedded self-assembled 3D photonic crystal structure."" In Women in Optics and Photonics in India 2022, vol. 12638, pp. 110-112. SPIE, 2023."
"Mini, Jayalekshmi, Navya Joseph, Rahul Sugathan, Chinnu Vasu Devan, Imaddin A. Al-Omari, Manoj Raama Varma, and Senoy Thomas. ""Structural and magnetic properties of Ni-substituted Y-type Ba0. 5Sr1. 5Zn2− x Ni x Fe12O22 (x= 0, 0.5, 1.0, and 1.5) hexaferrite."" Journal of Materials Science: Materials in Electronics 34, no. 3 (2023): 192."
"Mary, Anija, Yadhu Krishnan Edathumkandy, and Senoy Thomas. ""Asymmetry-driven reconfigurability of magnetic vortices in hemispherical shells."" Physica Scripta 98, no. 4 (2023): 045808."
"Joseph, Anit, Aneesh Ayyappan, Thoufeeq Subair, Manikanta Pandibayal, Swapna Nair, Revathy Ramany, Manoj Raama Varma, and Senoy Thomas. ""Pure and Sm doped CeO2 nanoparticles: An insight into the room temperature ferromagnetism and photocatalytic dye degradation."" ChemistrySelect 8, no. 20 (2023): e202301020."
"Arun, R., M. P. Athira, Sebastian Nybin Remello, and Suja Haridas. ""SBA-15-SO3H catalysed room temperature synthesis of 2-aryl benzimidazoles and benzothiazoles."" Reaction Kinetics, Mechanisms and Catalysis 136, no. 4 (2023): 2277-2294."
"Joseph, Merin, Mohammed Sadik N. K, Sebastian Nybin Remello, Suja Haridas, and Susmita De. ""Through space Sigma donation π acceptor assisted photocatalytic degradation of ciprofloxacin on TCPP supported g‐C3N4."" ChemistrySelect 8, no. 7 (2023): e202203348."
"Thomas, Arun, Yutaka Ohsaki, Ryosuke Nakazato, Fazalurahman Kuttassery, Siby Mathew, Sebastian Nybin Remello, Hiroshi Tachibana, and Haruo Inoue. ""Molecular Characteristics of Water-Insoluble Tin-Porphyrins for Designing the One-Photon-Induced Two-Electron Oxidation of Water in Artificial Photosynthesis."" Molecules 28, no. 4 (2023): 1882."
"Jagannivasan, Gopika, R. Arun, Mohit Kumar, Challapalli Subrahmanyam, Sebastian Nybin Remello, and Suja Haridas. ""Keggin type heteropolyacid-mediated novel green protocol for the synthesis of porphyrins."" New Journal of Chemistry 47, no. 29 (2023): 14010-14018."
"Joy, Rosmy, Merin K. Wilson, Aldrin Antony, Bharathi Konkena, Sibu C. Padmanabhan, Michael A. Morris, and Suja Haridas. ""Polyaniline wrapped graphene quantum dot decorated strontium titanate for robust high-performance flexible symmetric supercapacitors."" New Journal of Chemistry 47, no. 48 (2023): 22215-22225."
"Joseph, Merin, Mohammed Sadik N. K, Sebastian Nybin Remello, Suja Haridas, and Susmita De. ""Through space Sigma donation π acceptor assisted photocatalytic degradation of ciprofloxacin on TCPP supported g‐C3N4."" ChemistrySelect 8, no. 7 (2023): e202203348."
"Jagannivasan, Gopika, Gopika N. Nair, and Suja Haridas. ""Visible light-assisted H4 [PW11VO40] catalysed synthesis of bis (indolyl) methanes."" Molecular Catalysis 547 (2023): 113285."
"Arun, R., M. P. Athira, Sebastian Nybin Remello, and Suja Haridas. ""SBA-15-SO3H catalysed room temperature synthesis of 2-aryl benzimidazoles and benzothiazoles."" Reaction Kinetics, Mechanisms and Catalysis 136, no. 4 (2023): 2277-2294."
"Peter, Anmiya, Sreelakshmi Sadanandan, E. S. Bindiya, Nivedya Mohan, Sarita G. Bhat, and K. Abhitha. ""Biofilm inhibition on natural rubber by hydrophilic modification using carboxymethyl chitosan stabilised high energy faceted silver nanoparticles."" Carbohydrate Polymer Technologies and Applications 6 (2023): 100357."
