"Resmi, K. R., and K. Abhitha. ""Solvothermal synthesis of carbon dots from expanded polystyrene and flourimetric detection of Au3+ ions: Effect of various solvents."" In AIP Conference Proceedings, vol. 2783, no. 1. AIP Publishing, 2023."
"Bijina, V., P. J. Jandas, Sherin Joseph, J. Gopu, K. Abhitha, and Honey John. ""Recent trends in industrial and academic developments of green tyre technology."" Polymer Bulletin 80, no. 8 (2023): 8215-8244."
"Peter, Anmiya, Menon Divya Ramesh, E. S. Bindiya, Sarita G. Bhat, and K. Abhitha. ""CuO/Ag hybrid nanomaterial coated hydrophilic natural rubber film with minimal bacterial adhesion and contact killing efficiency."" Results in Engineering 17 (2023): 100998."
"Indira, V., and K. Abhitha. ""Mesoporogen-free synthesis of hierarchical zeolite A for CO2 capture: Effect of freeze drying on surface structure, porosity and particle size."" Results in Engineering 17 (2023): 100886."
"Bijina, Vijayan, Ponnath Janardhanan Jandas, Jesvin Jose, Nellorammal Muhammed Ajnas, Kozhikodan Parambil Abhitha, and Honey John. ""Tuning the low rolling resistance, wet grip, and heat build‐up properties of tyre tread formulations using carbon black/thermally exfoliated graphite hybrid fillers."" Journal of Applied Polymer Science 140, no. 8 (2023): e53508."
"Peter, Anmiya, Sherin Joseph, Honey John, and K. Abhitha. ""Edible and food-safe antiviral and antimicrobial smart coatings."" In Antiviral and Antimicrobial Smart Coatings, pp. 453-480. Elsevier, 2023."
"Aiswarya, P., Sarita G. Bhat, and Sreeja Narayanan. ""Organic Nanoparticles in Postharvest Management and the Mechanisms Involved."" Postharvest Nanotechnology for Fresh Horticultural Produce (2023): 49-75."
